{
  "source": "thunderstore",
  "repo": "https://github.com/KDavidP1987/Raphael-Lord-of-Wisdom",
  "package": "https://thunderstore.io/package/download/TheShadowRealm/Raphael/0.73.0/",
  "sha256": "ca959f5c7db9fcdfdc9ce0831793a0afafdee03dcadd17d2e2fcdee140348c39",
  "imported": true,
  "confirmed": false
}
