{
  "source": "thunderstore",
  "repo": "https://github.com/KDavidP1987/Faust-Lord-of-Investigation",
  "package": "https://thunderstore.io/package/download/TheShadowRealm/Faust/0.16.5/",
  "sha256": "102e562de0296218abfcc2aeaf6f565e78d264bc431200024ca47eb92f1d2fb5",
  "imported": true,
  "confirmed": false
}
