{
  "source": "thunderstore",
  "repo": "https://github.com/oscarpedrero/BloodyEncounters",
  "package": "https://thunderstore.io/package/download/Trodi/BloodyEncounters/3.0.0/",
  "sha256": "74644ee91021bf3b8741de9b2ee5a022d03a70216133f5f358ee12c811650699",
  "imported": true,
  "confirmed": false
}
