{
  "source": "thunderstore",
  "repo": "https://github.com/Kaltharos/VRising-CasualSiege",
  "package": "https://thunderstore.io/package/download/Kaltharos/CasualSiege/0.0.3/",
  "sha256": "7530cf4dcd935acb7c2a01371a431e7f71d95b87df43a8aaa70294a713d6ff59",
  "imported": true,
  "confirmed": false
}
