{
  "source": "thunderstore",
  "repo": "https://github.com/yukieiji/UnityExplorer",
  "package": "https://thunderstore.io/package/download/MaxGerman/UnityExplorer_IL2CPP/4.13.6/",
  "sha256": "c04b95aeb2ead9f405677b46d254b3cc81ad53274422f6c5f066cbbf1ff600a4",
  "imported": true,
  "confirmed": false
}
