{
  "source": "thunderstore",
  "repo": "https://github.com/Dawiss2/NightbaneHardcore",
  "package": "https://thunderstore.io/package/download/Dawiss/NightbaneHardcore/1.0.7/",
  "sha256": "44108497062e3f83679a5ba066f0eebd02fb1df42fd69903d8d356e29cc5e910",
  "imported": true,
  "confirmed": false
}
