{
  "source": "thunderstore",
  "repo": "https://github.com/skythebro/PotionsHaveContainers",
  "package": "https://thunderstore.io/package/download/Skies/PotionsHaveContainers/1.2.0/",
  "sha256": "f72e9f8581cfc55b50ca80290d314829182e62e068c7f083abbef17ca1381895",
  "imported": true,
  "confirmed": false
}
