{
  "source": "thunderstore",
  "repo": "https://github.com/Greeneye0/Satisvampory",
  "package": "https://thunderstore.io/package/download/Team_GreenEye/Satisvampory/1.0.85/",
  "sha256": "c8cefe980cf90abaa8f37381d3146c90215362592b9e992f539669b909cb5375",
  "imported": true,
  "confirmed": false
}
