{
  "source": "thunderstore",
  "repo": "https://github.com/cheesasaurus/ProfuselyViolentProgression",
  "package": "https://thunderstore.io/package/download/cheesasaurus/SurgeSuppressor/1.0.1/",
  "sha256": "9e90cb0e576ab2924bf34b1ab350269c68e32301195364c96793872a1602fe04",
  "imported": true,
  "confirmed": false
}
