{
  "source": "thunderstore",
  "repo": "https://github.com/Dawiss2/NightbaneManualEvents",
  "package": "https://thunderstore.io/package/download/Dawiss/NightbaneManualEvents/1.1.0/",
  "sha256": "001682117f3ce27ac726f16862849095931fda19e3416683a14b7d7079bae2e1",
  "imported": true,
  "confirmed": false
}
