{
  "source": "thunderstore",
  "repo": "https://github.com/Greeneye0/HuntsAndRifts",
  "package": "https://thunderstore.io/package/download/Team_GreenEye/HuntsAndRifts/1.0.0/",
  "sha256": "12a7bea644dc9f789344522383e0024ccf520f2a1d97bdd548559eb7f126b085",
  "imported": true,
  "confirmed": false
}
